"Paper Title","Paper Link","Publication Year","Publication Type","Publication Title","Author Names","DOI","PDF Link","Abstract","Relevant Excerpt"
"Artificial Intelligence Index Report 2024","https://scispace.com/paper/artificial-intelligence-index-report-2024-1vfbzcyd67","2024","Preprint","","Nestor Maslej
Loredana Fattorini
Raymond Perrault
Vanessa Parli
Anka Reuel
Erik Brynjolfsson
John Etchemendy
Katrina Ligett
Terah Lyons
James Manyika
Juan Carlos Niebles
Yoav Shoham
Ron Wald
Jack A. Clark","10.48550/arxiv.2405.19522","https://scispace.compdf/artificial-intelligence-index-report-2024-1vfbzcyd67.pdf","The 2024 Index is our most comprehensive to date and arrives at an important moment when AI's influence on society has never been more pronounced. This year, we have broadened our scope to more extensively cover essential trends such as technical advancements in AI, public perceptions of the technology, and the geopolitical dynamics surrounding its development. Featuring more original data than ever before, this edition introduces new estimates on AI training costs, detailed analyses of the responsible AI landscape, and an entirely new chapter dedicated to AI's impact on science and medicine. The AI Index report tracks, collates, distills, and visualizes data related to artificial intelligence (AI). Our mission is to provide unbiased, rigorously vetted, broadly sourced data in order for policymakers, researchers, executives, journalists, and the general public to develop a more thorough and nuanced understanding of the complex field of AI. The AI Index is recognized globally as one of the most credible and authoritative sources for data and insights on artificial intelligence. Previous editions have been cited in major newspapers, including the The New York Times, Bloomberg, and The Guardian, have amassed hundreds of academic citations, and been referenced by high-level policymakers in the United States, the United Kingdom, and the European Union, among other places. This year's edition surpasses all previous ones in size, scale, and scope, reflecting the growing significance that AI is coming to hold in all of our lives. ","2023, several challenging new benchmarks emerged, including SWE-bench for coding, HEIM for image generation, MMMU for general reasoning, MoCa for moral reasoning, AgentBench for agent-based behavior, and HaluEval for hallucinations. Better AI means better data which means … even better AI.:
 New AI models such as SegmentAnything and Skoltech are being used to generate specialized data for tasks like image segmentation and 3D reconstruction. Data is vital for AI technical improvements. Better AI means better data which means … even better AI.:
 The use of AI to create more data enhances current capabilities and paves the way for future algorithmic improvements, especially on harder tasks. Human evaluation is in.:
 With generative models producing high-quality text, images, and more, benchmarking has slowly started shifting toward incorporating human evaluations like the Chatbot Arena Leaderboard rather than computerized rankings like ImageNet or SQuAD. Public feeling about AI is becoming an increasingly important consideration in tracking AI progress. Thanks to LLMs, robots have become more flexible. The fusion of language modeling with robotics has:
 given rise to more flexible robotic systems like PaLM-E and RT-2. Beyond their improved robotic capabilities, these models can ask questions, which marks a significant step toward robots that can interact more effectively with the real world. More technical research in agentic AI.:
 Creating AI agents, systems capable of autonomous operation in specific environments, has long challenged computer scientists. However, emerging research suggests that the performance of autonomous AI agents is improving. Current agents can now master complex games like Minecraft and effectively tackle real-world tasks, such as online shopping and research assistance. Timeline: Significant Model Releases:
 As chosen by the AI Index Steering Committee, here are some of the most notable model releases of 2023. Overview of AI in 2023:
 The technical performance chapter begins with a high-level overview of significant model releases in 2023 and reviews the current state of AI technical performance. Overview of AI in 2023:
 Chapter 2: Claude is designed to be as helpful, honest, and harmless as possible. State of AI Performance:
 As of 2023, AI has achieved levels of performance that surpass human capabilities across a range of tasks. AI Index Benchmarks:
 An emerging theme in AI technical performance, as emphasized in last year's report, is the observed saturation on many benchmarks, such as ImageNet, used to assess the proficiency of AI models. AI Index Benchmarks:
 Performance on these benchmarks has stagnated in recent years, indicating either a plateau in AI capabilities or a shift among researchers toward more complex research challenges. ue to saturation, several benchmarks featured in the 2023 AI Index have been omitted from this year's report. Figure .1.17 AI Index Benchmarks:
 highlights a selection of benchmarks that were included in the 2023 edition but not featured in this year's report. It also shows the improvement on these benchmarks since 2022. AI Index Benchmarks:
 ""NA"" indicates no improvement was noted. Most benchmarks see significant performance increases relatively soon after they are introduced, then the improvement slows. In the last few years, many of these benchmarks have shown little or no improvement. Overview of AI in 2023:
 Artificial Intelligence Index Report 2024 Understanding:
 English language understanding challenges AI systems to understand the English language in various ways such as reading comprehension and logical reasoning."
"On the need for a global AI ethics","https://scispace.com/paper/on-the-need-for-a-global-ai-ethics-7cuicljwcf12","2024","Journal Article","Journal of Global Ethics","Björn Lundgren
Eleonora Catena
Ian Robertson
Max Hellrigel-Holderbaum
Ibifuro Robert Jaja
Leonard Dung","10.1080/17449626.2024.2425366","https://scispace.compdf/on-the-need-for-a-global-ai-ethics-7cuicljwcf12.pdf","The impact of artificial intelligence (AI) is not only global but globally varied. Yet, AI ethics is all too often overly localised. This paper discusses the potential of a global AI ethics, highlighting several important variables that it should take into account if it is to be as successful an enterprise as it needs to be. ","2023, several challenging new benchmarks emerged, including SWE-bench for coding, HEIM for image generation, MMMU for general reasoning, MoCa for moral reasoning, AgentBench for agent-based behavior, and HaluEval for hallucinations. Better AI means better data which means … even better AI.:
 New AI models such as SegmentAnything and Skoltech are being used to generate specialized data for tasks like image segmentation and 3D reconstruction. Data is vital for AI technical improvements. Better AI means better data which means … even better AI.:
 The use of AI to create more data enhances current capabilities and paves the way for future algorithmic improvements, especially on harder tasks. Human evaluation is in.:
 With generative models producing high-quality text, images, and more, benchmarking has slowly started shifting toward incorporating human evaluations like the Chatbot Arena Leaderboard rather than computerized rankings like ImageNet or SQuAD. Public feeling about AI is becoming an increasingly important consideration in tracking AI progress. Thanks to LLMs, robots have become more flexible. The fusion of language modeling with robotics has:
 given rise to more flexible robotic systems like PaLM-E and RT-2. Beyond their improved robotic capabilities, these models can ask questions, which marks a significant step toward robots that can interact more effectively with the real world. More technical research in agentic AI.:
 Creating AI agents, systems capable of autonomous operation in specific environments, has long challenged computer scientists. However, emerging research suggests that the performance of autonomous AI agents is improving. Current agents can now master complex games like Minecraft and effectively tackle real-world tasks, such as online shopping and research assistance. Timeline: Significant Model Releases:
 As chosen by the AI Index Steering Committee, here are some of the most notable model releases of 2023. Overview of AI in 2023:
 The technical performance chapter begins with a high-level overview of significant model releases in 2023 and reviews the current state of AI technical performance. Overview of AI in 2023:
 Chapter 2: Claude is designed to be as helpful, honest, and harmless as possible. State of AI Performance:
 As of 2023, AI has achieved levels of performance that surpass human capabilities across a range of tasks. AI Index Benchmarks:
 An emerging theme in AI technical performance, as emphasized in last year's report, is the observed saturation on many benchmarks, such as ImageNet, used to assess the proficiency of AI models. AI Index Benchmarks:
 Performance on these benchmarks has stagnated in recent years, indicating either a plateau in AI capabilities or a shift among researchers toward more complex research challenges. ue to saturation, several benchmarks featured in the 2023 AI Index have been omitted from this year's report. Figure .1.17 AI Index Benchmarks:
 highlights a selection of benchmarks that were included in the 2023 edition but not featured in this year's report. It also shows the improvement on these benchmarks since 2022. AI Index Benchmarks:
 ""NA"" indicates no improvement was noted. Most benchmarks see significant performance increases relatively soon after they are introduced, then the improvement slows. In the last few years, many of these benchmarks have shown little or no improvement. Overview of AI in 2023:
 Artificial Intelligence Index Report 2024 Understanding:
 English language understanding challenges AI systems to understand the English language in various ways such as reading comprehension and logical reasoning."
"A Systematic Review of Artificial Intelligence Applied to Facility Management in the Building Information Modeling Context and Future Research Directions","https://scispace.com/paper/a-systematic-review-of-artificial-intelligence-applied-to-1dw9fs9x","2022","Journal Article","Buildings","Rodrigo Pedral Sampaio
António Aguiar Costa
Inês Flores-Colen","10.3390/buildings12111939","https://scispace.com/pdf/a-systematic-review-of-artificial-intelligence-applied-to-1dw9fs9x.pdf","Throughout the operation and maintenance (O&M) stage, facility management (FM) teams collect and process data from different sources, often needing to be adequately considered when making future decisions. This data could feed statistical models based on artificial intelligence (AI), thus improving decision-making in FM. Building information modeling (BIM) appears in this context, leveraging how data and information are systematized, enabling structured information and its use. This article addresses the state-of-the-art of using AI techniques applied to FM in the BIM context, analyzing articles between 2012 and 2021 related to this area. It is interesting to note that only from 2018 onwards, there is a substantial increase in these publications, from about 8 publications (2012 to 2017) to 24 publications (2018 to 2021) on average. This growth shows the progressive application of the optimization methods mentioned above, which opens new opportunities for the FM profession. This study contributes to the body of knowledge by highlighting the investigated tendency and gaps in critical areas and their relationship with the research topic. Noteworthy future directions are suggested, directing on (i) data and system integration; (ii) predictive models; (iii) automatic as-built/classification; (iv) internet of things; (v) energy management; and (vi) augmented/virtual reality.","from IFC schemas and substantially improves the integration process. Furthermore, ontology serves as the core mechanism for ML flows, such as the complex interactions representing machineunderstandable data and ML algorithms, making it simpler for data and information extraction tools to communicate . Data and Systems Integration:
 As the ontology studies in the AECFM industry increase, this hybrid approach, using middleware, will also increase due to the systems' communication. The benefits of AI and the transformation of information into knowledge via ontological studies for a decisionsupporting and automated model in facility management emerge as insights into the future trend. In contrast, due to the BIM-FM interoperability problems, a future agenda involves: (i) tailored solutions for each case study to make data exchangeable, (ii) the development of a taxonomy of non-geometric information and each ontology, and (iii) the optimization of O&M processes and complex programming tasks. Predictive Models:
 Buildings are complex structural systems that deteriorate over time, with differentiated degradation rates, subject to several factors, including aggressive environmental agents, insufficient maintenance programs, construction problems, and inadequate design . Corrective maintenance incurs unplanned downtime costs, estimated to be $50 billion annually . Therefore, predictive maintenance becomes increasingly important, influencing buildings' long-term longevity and components, reducing almost 98% of the maintenance cost and ensuring occupants' comfort level, productivity, and health . Predictive Models:
 Given the vast number of existing buildings, the asset manager's primary task is to guarantee that existing assets function as expected within predetermined quality requirements while minimizing costs . However, facility managers plan work orders subjectively based on work background , resulting, for example, in lower energy efficiency and decreased occupant satisfaction . Predictive Models:
 The conducted review showed that 83% (26) of the total category selected articles (33) were published between 2019 and 2021. Currently, facility managers have large amounts of data that require time and resources. Additionally, the key to scheduling when a required intervention is necessary depends on the ability to predict the future condition of the asset and, in most cases, the interconnections between the various building mechanisms and systems, the diversity of building components, and several changing environmental factors that are overlooked. Predictive Models:
 When physical-based models are unavailable or difficult to deploy, medium-to longterm intervention planning is often based on periodic inspections combined with statistical models. Thus, AI can intelligently connect this data, whereas humans' capacity to process this information is often limited . Predictive Models:
 Briefly, Sousa et al.  evaluated the performance of AI-based models, namely artificial neural networks (ANNs) and support vector machines (SVMs), in predicting the structural state of sewers and improved the performance condition predicted from around 66% to 75% and 71%, respectively, when compared with traditional models. Cheng et al.  applied ANNs and SVM to predict the condition to maintain or repair mechanical, electrical, and plumbing (MEP) components and found around 96% and 97% of prediction accuracy. Ivanko et al.  used several ML to perform the uses of domestic water heaters and found a prediction accuracy of over 80% with ANNs, Prophet, and XGBoost techniques."
"Designing and Managing Human-AI Interactions","https://scispace.com/paper/designing-and-managing-human-ai-interactions-2s68xpjt","2022","Journal Article","Information Systems Frontiers","Babak Abedin
Christian Meske
Iris A. Junglas
Fethi A. Rabhi
Hamid Reza Motahari-Nezhad","10.1007/s10796-022-10313-1","https://scispace.com/pdf/designing-and-managing-human-ai-interactions-2s68xpjt.pdf","","explainable AI, or interpretable machine learning techniques, are often developed by computer scientists for computer scientists ; in contrast, we argue that research on explainability needs to focus more on end-users who require different, and more approachable, forms of explanations. Explainability and Accountability, Fairness and Bias:
 Another problem is that complex AI systems tend to be developed as a composition of multiple software components, APIs, and libraries, each of which has different interaction and reporting mechanisms that were designed in isolation. Integrating different logging and reporting information into a coherent narrative for end-users is a formidable challenge. In addition, questions of explainability and accountability need to be answered for different stakeholders (e.g., regulators, developers, managers, users) along with the process of AI design and management. AI Agency and Human Interaction with Agentic AI:
 As advances in AI algorithms and systems provide proxy agency to users through customization of tasks and decision, they become increasingly capable of exerting their own agency , which in turn gives rise to the tension between machine agency and human agency . There are different research streams on agency, many of which discuss agency only as a potential attribute of humans (e.g., . We argue that because of AI's increasing capability to autonomously carry out tasks, AI should increasingly be viewed as a potential ""team member."" Research needs to further investigate the extent to which AI can have or develop agency itself. This notion of agentic AI raises questions on how changes in the -How do interfaces need to be designed in order to increase trust and technology acceptance? -What can (IT) management learn from how the interface of AI is used (e.g., which features)? AI Agency and Human Interaction with Agentic AI:
 -Which role does the user interface play in managing human-AI interaction? AI Agency and Human Interaction with Agentic AI:
 Human-AI Conversations and Collaboration -How should communication between AI and humans be designed in order to avoid misunderstandings on both ends? AI Agency and Human Interaction with Agentic AI:
 -How can AI be designed in order for it to adapt to individual characteristics of humans? -How should the collaborative interplay between humans and AI be orchestrated in order to harness the potential of hybrid intelligence? AI Agency and Human Interaction with Agentic AI:
 -How can information exchange in human-AI interaction be documented and used to foster organizational knowledge management? AI Agency and Human Interaction with Agentic AI:
 Explainability, Accountability, ethics, fairness and bias -How can explainability be designed into the process from AI development by experts (e.g., engineers) to AI usage by laymen? AI Agency and Human Interaction with Agentic AI:
 -To which extend may we need to expand or re-think the term 'explainability' in the context human-AI interaction? AI Agency and Human Interaction with Agentic AI:
 -What are AI system design consideration for accountability, ethics, fairness and bias of AI systems in operation in human society? -How should AI governance be implemented in organizations in order to supervise human-AI interaction and to allocate responsibility as well as accountability? AI Agency and Human Interaction with Agentic AI:
 -How does explainability influence the possibility to manage and AI? AI Agency and Human Interaction with Agentic AI:
 -What processes are needed in AI governance to deal with accountability, ethics, fairness and bias issues in decisions or recommendations made by AI?"
"Is machine learning good or bad for the natural sciences?","https://scispace.com/paper/is-machine-learning-good-or-bad-for-the-natural-sciences-1uqrgmqf53","2024","Preprint","","David W. Hogg
Soledad Villar","10.48550/arxiv.2405.18095","https://scispace.compdf/is-machine-learning-good-or-bad-for-the-natural-sciences-1uqrgmqf53.pdf","Machine learning (ML) methods are having a huge impact across all of the sciences. However, ML has a strong ontology - in which only the data exist - and a strong epistemology - in which a model is considered good if it performs well on held-out training data. These philosophies are in strong conflict with both standard practices and key philosophies in the natural sciences. Here, we identify some locations for ML in the natural sciences at which the ontology and epistemology are valuable. For example, when an expressive machine learning model is used in a causal inference to represent the effects of confounders, such as foregrounds, backgrounds, or instrument calibration parameters, the model capacity and loose philosophy of ML can make the results more trustworthy. We also show that there are contexts in which the introduction of ML introduces strong, unwanted statistical biases. For one, when ML models are used to emulate physical (or first-principles) simulations, they introduce strong confirmation biases. For another, when expressive regressions are used to label datasets, those labels cannot be used in downstream joint or ensemble analyses without taking on uncontrolled biases. The question in the title is being asked of all of the natural sciences; that is, we are calling on the scientific communities to take a step back and consider the role and value of ML in their fields; the (partial) answers we give here come from the particular perspective of physics. ","Position Paper we will exclude more engineering-oriented questions such as: What protein sequences might be important for the treatment of diabetes? Or where in Canada might there be new uranium deposits? Or what kinds of catalytic surfaces might help turn biomass into biofuel? The ontology and epistemology of machine learning:
 This is a bit unfair! We are excluding these kinds of questions in part because it is obvious that ML methods can serve important purposes in such problems. The ontology and epistemology of machine learning:
 In addition, we recognize that there are quite a few different attitudes that a scientist can take towards the concept of ""understanding"". Does a program that can predict and control a robot arm accurately ""understand"" the arm? Or does a system that can predict protein foldings ""understand"" protein folding? The ontology and epistemology of machine learning:
 We are using a restricted definition of ""understanding"" that excludes these operational successes; mostly in the natural sciences we are looking for semantic rather than operational understandings of systems. But of course ML often can provide extremely operationally capable systems. The ontology and epistemology of machine learning:
 Ontologies: The ontology of a domain is (for our purposes) the set of things that exist within that domain. What is the ontology of ML? The ontology and epistemology of machine learning:
 Unsupervised and self-supervised ML methods deliver representations, descriptions, or compressions of data. Supervised ML methods find relationships between data (features) and data (labels). In both cases, the methods are judged on their capability to accurately describe the data. They are (often) not judged on the details of their latent structure. The ontology and epistemology of machine learning:
 In a very important sense, the ML ontology is that only the data exist. The ontology and epistemology of machine learning:
 In support of this point of view, here are some comments: Deep-learning models have enormously large internal degeneracies (combinatorial degeneracies even). These degeneracies are not seen as a problem, since all they do is make the latent weights less interpretable without hurting performance . The ontology and epistemology of machine learning:
 Contemporary optimization schemes are stochastic  and most models are non-convex. The ontology and epistemology of machine learning:
 The fact that it is impossible to find the global optimumand the fact that in most contemporary models that isn't even the goal-shows that the latent parameters are not important. The ontology and epistemology of machine learning:
 The regularization of trained models with early stopping  and dropouts  demonstrate that there isn't even a goal of getting precisely to any optimum. The ontology and epistemology of machine learning:
 Any practitioner using a 23-layer network can trivially (and without analysis) switch to a 42-layer, despite the fact that (from a functional point of view), this might substantially change the model capacity or expressivity. The ontology and epistemology of machine learning:
 In ML, models are deemed stably optimized and useful not if the latent space-the joint values of all the weights and biases-is stable, but rather if the predictions for held-out data are stable."
