"Paper Title","Paper Link","Publication Year","Publication Type","Publication Title","Author Names","DOI","PDF Link","Abstract","Relevant Excerpt"
"An AI-Driven Data Mesh Architecture Enhancing Decision-Making in
  Infrastructure Construction and Public Procurement","https://scispace.com/paper/an-ai-driven-data-mesh-architecture-enhancing-decision-4vauus3moqwf","2024","Journal Article","","Saurabh Mishra
Mahendra Shinde
Archana Yadav
Bilal M. Ayyub
Anand B. Rao","10.48550/arxiv.2412.00224","https://scispace.compdf/an-ai-driven-data-mesh-architecture-enhancing-decision-4vauus3moqwf.pdf","Infrastructure construction, often dubbed an ""industry of industries,"" is closely linked with government spending and public procurement, offering significant opportunities for improved efficiency and productivity through better transparency and information access. By leveraging these opportunities, we can achieve notable gains in productivity, cost savings, and broader economic benefits. Our approach introduces an integrated software ecosystem utilizing Data Mesh and Service Mesh architectures. This system includes the largest training dataset for infrastructure and procurement, encompassing over 100 billion tokens, scientific publications, activities, and risk data, all structured by a systematic AI framework. Supported by a Knowledge Graph linked to domain-specific multi-agent tasks and Q&A capabilities, our platform standardizes and ingests diverse data sources, transforming them into structured knowledge. Leveraging large language models (LLMs) and automation, our system revolutionizes data structuring and knowledge creation, aiding decision-making in early-stage project planning, detailed research, market trend analysis, and qualitative assessments. Its web-scalable architecture delivers domain-curated information, enabling AI agents to facilitate reasoning and manage uncertainties, while preparing for future expansions with specialized agents targeting particular challenges. This integration of AI with domain expertise not only boosts efficiency and decision-making in construction and infrastructure but also establishes a framework for enhancing government efficiency and accelerating the transition of traditional industries to digital workflows. This work is poised to significantly influence AI-driven initiatives in this sector and guide best practices in AI Operations. ","Arc: Arc has the potential to influence the way data pipelines are developed and maintained by automating critical aspects of the data management process. Its impact on improving data quality and pipeline efficiency is substantial, offering a promising path towards more reliable and scalable data products. F. Advancing Data Structuring with Arc:
 Future enhancements may include broader integration capabilities with other data management systems and further automation of data pipeline components. Arc represents a significant leap forward in data pipeline management, providing a robust framework for data ingestion, updating, and validation. F. Advancing Data Structuring with Arc:
 By automating essential processes and offering a suite of utility functions,Arc enables developers to focus more on delivering value through their data products and less on the intricacies of data pipeline management. F. Advancing Data Structuring with Arc:
 Its adoption not only promises to enhance the efficiency and reliability of data products but also sets a new standard for data pipeline development in the engineering field. III. SYSTEMATIC AI FRAMEWORK FOR REAL-WORLD APPLICATIONS:
 The systematic AI framework within is centered around a Central AI Agent complemented by a suite of Multi-Agents. This framework exemplifies advanced data integration and visualization techniques tailored for infrastructure projects. III. SYSTEMATIC AI FRAMEWORK FOR REAL-WORLD APPLICATIONS:
 The Central AI Agent utilizes domain-specific language and a modular approach, allowing for a ""human-in-the-loop"" process that guides the creation of knowledge from standardized AI data and scalable web sources. III. SYSTEMATIC AI FRAMEWORK FOR REAL-WORLD APPLICATIONS:
 This knowledge is then linked to various Multi-Agents, each designed for hyper-specific tasks, such as researching the latest project updates or extracting best practices from top-tier journal publications. III. SYSTEMATIC AI FRAMEWORK FOR REAL-WORLD APPLICATIONS:
 Other agents, including multi-modal ones, are equipped to understand and analyze local environmental conditions, assess risks, or conduct in-depth comparative research on past projects to inform qualitative judgments. III. SYSTEMATIC AI FRAMEWORK FOR REAL-WORLD APPLICATIONS:
 A key feature of this framework is its focus on uncertainty quantification and transparency. The system continuously calls underlying processes to ensure that results are robust and reliable-this is one of its distinguishing factors. Beyond the deployment of Multi-Agents, the framework includes Meta-Agents capable of real-time market analysis. III. SYSTEMATIC AI FRAMEWORK FOR REAL-WORLD APPLICATIONS:
 These Meta-Agents can scan 's data, news sources, and the web to either compile a comprehensive list of opportunities or provide a completed market landscape view to understand stakeholder dynamics. III. SYSTEMATIC AI FRAMEWORK FOR REAL-WORLD APPLICATIONS:
 The framework's modularity extends to its internal workspace, designed to mitigate risks associated with downtime or latency. III. SYSTEMATIC AI FRAMEWORK FOR REAL-WORLD APPLICATIONS:
 This workspace keeps various large language models (LLMs) modular, enabling the system to call upon different models-such as GPT-4o, Mistral, LLaMA, or other configurations like RAG or graphRAG -depending on the specific use case for Multi-Agents. III. SYSTEMATIC AI FRAMEWORK FOR REAL-WORLD APPLICATIONS:
 To illustrate the practical application of this framework, consider the challenge of managing and interpreting the multitude of data associated with large infrastructure projects. These projects often involve wide-reaching impacts, making it essential to accurately integrate diverse data sources such as recent news, internet publications, and bibliometrics."
"Data-Driven Approaches to Improve Operations of Biological Processes in WRRFs: Analytics, Model and Optimization","https://scispace.com/paper/data-driven-approaches-to-improve-operations-of-biological-13phkgpf","2022","Journal Article","","Ana Emília Figueiredo de Oliveira","10.7302/6086","https://scispace.com/pdf/data-driven-approaches-to-improve-operations-of-biological-13phkgpf.pdf","","considered as a resource for water, energy, heat and chemicals . While both the academic and industrial water sectors are dedicating to sustainability by developing newer treatment technologies, digital solutions that embrace big data and artificial intelligence (AI) emerge and attract broad attention . CHAPTER I Introduction:
 An international survey (2019) of the global urban wastewater management community identified the emerging opportunities and threats introduced by digital transformation, ubiquitous sensing and new data sources . A satisfactory response with a total of 309 surveys was received, covering the academic sector (60%), environmental consultants (20%), utilities (15%), manufacturers, government, and students (< 5%). Europe (67%) and North America (21%) dominated the responses, and only a few were from South America, Africa, and Australasia. The top ten novel top-ics 1 (out of 35) were identified where Ontology ranked third. Ontology is defined as a systematic representation of the available urban water management knowledge, whose key elements include the construction of digital intelligent agents that successfully deploy the knowledge available to make autonomous decisions or suggestions to an expert user. This rank indeed reveals the demand and tendency of calling for research in digital solutions to advance wastewater treatment, although their developments are still within the early stage. CHAPTER I Introduction:
 Historically, the ontology of wastewater treatment was often constrained by difficulties in collecting data, however, the growing ubiquity of sensors and meters exposes utilities to an unprecedented amount of data . For instance, small facilities (˜20,000 Population Equivalents, PE) can generate up to 400 signals, whereas large ones produce more than 30,000 . Meanwhile, the data is acquired from various sources in WRRFs: laboratory analysis, online sensor measurements, operation and maintenance logs and others. Each source creates data that are different in magnitude, types (numerical, categorical, textual) and frequency (from minutes to months). CHAPTER I Introduction:
 Due to the size and complexity of datasets generated by WRRFs, and the common lack of data science background for water professionals, a vast amount of raw data remain buried in 'data graveyards', as has been recognized that data-rich is all too often equivalent to information-poor . How to transform these data into actionable knowledge to advance wastewater treatment and what roles can data-driven tools play in the transformation are fundamental and ongoing research topics. CHAPTER I Introduction:
 The wastewater treatment community has been actively exploring approaches to take full advantage of WRRF data and has created a large volume of studies  Control increases the stability of processes to ensure good performance at all the time and to optimize the usage of resources. Control design relies heavily on the data."
"Ontology-Based Production Simulation with OntologySim","https://scispace.com/paper/ontology-based-production-simulation-with-ontologysim-5iv30rit","2022","Journal Article","Applied Sciences","Marvin Carl May
Lars Kiefer
Andreas Kuhnle
Gisela Lanza","10.3390/app12031608","https://scispace.com/pdf/ontology-based-production-simulation-with-ontologysim-5iv30rit.pdf","Imagine the possibility to save a simulation at any time, modify or analyze it, and restart again with exactly the same state. The conceptualization and its concrete manifestation in the implementation OntologySim is demonstrated in this paper. The presented approach of a fully ontology-based simulation can solve current challenges in modeling and simulation in production science. Due to the individualization and customization of products and the resulting increase in complexity of production, a need for flexibly adaptable simulations arises. This need is exemplified in the trend towards Digital Twins and Digital Shadows. Their application to production systems, against the background of an ever increasing speed of change in such systems, is arduous. Moreover, missing understandability and human interpretability of current approaches hinders successful, goal oriented applications. The OntologySim can help solving this challenge by providing the ability to generate truly cyber physical systems, both interlocked with reality and providing a simulation framework. In a nutshell, this paper presents a discrete-event-based open-source simulation using multi-agency and ontology.","systems . For the application in complex systems, multi-agent-based can be advantageous because of the decentralized and robust structure . The OntologySim is a discrete event-based, multi-agent system. The exact classification of the simulation is discussed in Section 4. Simulation:
 Besides the modeling type, a simulation consists of the following components according to the VDI3633 : a simulation kernel, data management (see Figure ), user interface, and interfaces to external databases. The simulation kernel contains the model world and necessary elements, particularly events to ensure automatic execution . The last level, the interfaces to external databases, is not included in this simulation because the OntologySim attempts to represent as many applications as possible, and this interlocking with a particular external database conflicts with the many individual external databases prevailing in real production systems. Hence, a config file or owl file specifying the required information to be extracted before or while execution and API interfaces serve as external interfaces. For more detail, the reader is referred to Section 7. Term Ontology-Based Simulation:
 Ontology-based simulation as a term is used differently throughout the literature as the degree of ontology application is not clearly defined. The proposed classification scheme, as shown in Figure , is based on References  and has been adapted and integrated with respect to simulations based on an ontology. The Ontology Integration Level (OIL) for simulations continuously increases from production capacity to ontologies that store all subcategories and simulation specifications. It allows the classification of ontologies that are interwoven with an ontology-based simulation in the area of production simulations. The highest ontology integration level contains all information of the previous levels and focuses on all further necessary information, such as current time steps or work orders, to be contained in the ontology. Fully ontology-based simulations allow saving the ontology, and, thus, the simulation core and current status, at any time without information loss. This is possible when both the data management and the simulation kernel are integrated into the ontology. Term Ontology-Based Simulation:
 According to this definition, OntologySim is a fully ontology-based simulation in ontology integration level 5. Related Work:
 As introduced in Section 2.3, different integration levels for ontologies in simulation and production exist. The literature in this domain is reviewed and extended with other approaches of ontology-based simulations in Section 3.1. Then, available simulations for production systems are reviewed in Section 3.2. Literature Review:
 In the literature, there are many approaches to integrate ontologies in production and simulation. The majority of approaches to date focus on using the ontology as a memory or database to build a simulation model. This is similar to handling the simulation data management with the help of an ontology, yet, the simulation itself remains unchanged. Based on a grounded theory literature review , a large set of papers dealing with both simulation and ontology or both digital twin and ontology in the domain of production research were identified. By manual analysis a total of 20 papers, the most relevant research approaches were selected (cf. Table ), with priority given to approaches with higher Ontology Integration Levels and the requirement of including ontologies from a research perspective in production organization. In general, the existing approaches can be clustered as follows:"
"Simple Agentic AI workflow for AIOPS (Agentic AIOps)","https://scispace.com/paper/simple-agentic-ai-workflow-for-aiops-agentic-aiops-we2icokfsa9i","2025","Journal Article","","A. Surendar","10.71097/ijsat.v16.i3.8359","https://scispace.compdf/simple-agentic-ai-workflow-for-aiops-agentic-aiops-we2icokfsa9i.pdf","This paper showcases a simple Agentic AI framework aimed at improving AIOps through the deployment of autonomous, goal-oriented agents. Artificial Intelligence for IT Operations (AIOps) refers to the application of AI and machine learning to make IT operations run more efficiently and automatically. This work demonstrates AI agents for detecting problems, automated baselining deduplication of alerts and remediation. By removing unnecessary alerts, the AI agent for deduplication makes sure that only distinct and actionable alerts move to the next phase. Using anomaly detection algorithms, the operational system identifies unexpected things in operational data streams, such as logs, metrics, and traces. Agents employ ARIMA time-series modeling, and past events to baseline metrics and start resolving automatically in case of anomaly, such as by adding more resources or restarting services. Agents may make incident resolution work better by constantly improving their answers with feedback. This agentic workflow uses smart policy engines, automation frameworks, and observability tools to build a scalable base for proactive and self-healing AIOps settings. Using AI agents to accomplish different tasks in AIOPS makes things operate more smoothly and needs less interference from people. ","(IJSAT) Authors: Surendar Raj Keywords: Artificial Intelligence for IT Operations (AIOps), AI Agents, Operations Management (ITOM), Automated deduplication, Automated baselining, Automated Remediation, Agentic AI AIOps Introduction:
 Operations management has become more complex than ever before due to the exponential growth of modern IT infrastructures (ITOM) , which are fueled by cloud-native architectures, microservices, container orchestration platforms, and large-scale distributed systems. Introduction:
 Today's businesses produce enormous amounts of diverse telemetry data at a rapid pace, such as logs, metrics, events, and distributed traces. It has become more difficult to manage such an environment using conventional rulebased monitoring techniques. Introduction:
 In dynamic environments where workloads, resource utilization, and system behavior are constantly changing, static thresholds, manual triaging, and operator-driven root cause analysis frequently fall short. Organizations suffer from misdiagnosis of failures, delayed incident resolution, and a sharp rise in operational overhead as a result. Introduction:
 The introduction of Artificial Intelligence for IT Operations (AIOps), a term first used by Gartner in 2017, was a big step forward. . Artificial Intelligence for IT Operations (AIOps) has become a new way of thinking about how to solve these problems. Introduction:
 AI and machine learning are used by AIOps systems to find problems, automate root cause analysis, connect events, and fix problems before they happen. Introduction:
 However, many current AIOps implementations are constrained because they rely on separate automation scripts, don't coordinate well between agents, and don't have a good sense of context. Introduction:
 They might be able to find anomalies or remove duplicate alerts on their own, but they rarely show adaptive, goal-driven behaviors that can change with the situation. Introduction:
 Businesses that use agent-based AIOps will save a lot of money by reducing manual interventions, improve system resilience, and decrease downtime. Organizations can create a truly autonomous IT ecosystem where incidents are identified, examined, and resolved quickly by integrating intelligent policy engines, automation frameworks, and observability layers. Introduction:
 The incorporation of autonomous, goal-driven software agents into IT operations pipelines, or Agentic AIOps, has gained attention because of this gap. Intelligent, modular agents with the ability to cooperate, share memory, and react dynamically to changing operational states are introduced by an agentic framework. Research Methodology:
 Daniel Zota et al.  presents a new framework for an Agentic AIOps system, including its essential elements, features, and architectural specifications. The framework emphasizes the employment of intelligent, context-aware, self-learning agents to manage issues and incidents, fulfill requests, and prevent problems before they become problems. Research Methodology:
 While staying flexible enough to accommodate the constantly changing technology present in actual organizational settings, it is made to conform to wellknown service management best practices like ITIL  and the Unified Process Framework for IT (UPF-IT). Research Methodology:
 Additionally, the framework facilitates scalable deployment for middleware, data, applications, infrastructure, and other levels of the IT ecosystem. Research Methodology:
 After filtering 140 publications based on credibility, relevance, and recentness, 42 high-impact studies were chosen as the final group. Key topics essential to the development of AIOps are reflected in these publications are:"
"Social-economic aspects of the implementation of natural intelligence technologies: part 2 - natural intelligence in government","https://scispace.com/paper/social-economic-aspects-of-the-implementation-of-natural-d2h6jr3pqf","2023","Journal Article","Deleted Journal","A. V. Yeremin
E. V. Yeremin
K. D. Polyakova
M. V. Fedorov","10.24833/14511791-2023-2-6-74","https://scispace.compdf/social-economic-aspects-of-the-implementation-of-natural-d2h6jr3pqf.pdf","The purpose of this article is to investigate the application of artificial intelligence (AI) in public administration. Following up the research of M.V. Fedorov [38- 41], which provides an overview of the global effects of AI implementation, covering socio-ethical aspects, economic impact and regulatory framework for sustainable development strategies, the present paper focuses on the key factors that define the framework for the use of AI in public administration. The paper considers AI as part of the overall process of technological development and explores the links between AI and other areas such as computing technology and data collection techniques. Particular attention is paid to the analysis of international and Russian experience of implementing AI in public administration. The authors seek to develop recommendations for further development of this industry based on the experience gained. They also consider approaches that may lead to the development of strategic principles focused on long-term predictions of the effects of AI in optimising public administration, and the subsequent implementation of appropriate regulatory practices. Thus, this article seeks to provide an overview and analysis of the main aspects of the use of AI in public administration with a focus on international and Russian experience, and to offer recommendations for the further development of this field. ","важность информационно-коммуникационной инфраструктуры, программного обеспечения, обработки данных и поиска решений в контексте ИИ. Онтологические проблемы в сфере ИИ:
 Недавно Академик РАН И.А.Каляев предложил количественный подход к измерению «мощности» ИИ, основываясь на количестве тестовых интеллектуальных задач, которые система ИИ способна решить за единицу времени . Полагаем, это весьма интересный подход для разработки непротиворечивой системы терминологии в области ИИ и смежных технологий. Онтологические проблемы в сфере ИИ:
 Однако следует признать, что дискуссия по определениям и терминологии ИИ продолжается в экспертном сообществе, и новые исследования и разработки могут привести к пересмотру и уточнению этих определений в будущем. СТРАТЕГИЧЕСКИЕ ВЫЗОВЫ:
 Стоит также отметить, что размытостью терминологии ИИ, онтологические проблемы в этой сфере не ограничиваются. Мы отмечаем еще ряд проблем онтологического характера, которые требуется решить в процессе широкого внедрения ИИ в госуправлении. СТРАТЕГИЧЕСКИЕ ВЫЗОВЫ:
 -Онтологическая неоднозначность данных: внедрение ИИ в государственное управление требует обработки больших объемов слабо структурированных данных. Заметная часть из них представлена в текстовом виде. Однако возникает проблема неоднозначности семантики и синтаксиса этих данных, что затрудняет их интерпретацию и использование."
