"Paper Title","Paper Link","Publication Year","Publication Type","Publication Title","Author Names","DOI","PDF Link","Abstract","Relevant Excerpt"
"Usage Governance Advisor: from Intent to AI Governance","https://scispace.com/paper/usage-governance-advisor-from-intent-to-ai-governance-2axhub0husw3","2024","Journal Article","","Elizabeth Daly
Sean Rooney
Seshu Tirupathi
Luis Garcés-Erice
Inge Vejsbjerg
Frank Bagehorn
Dhaval Salwala
Christopher Giblin
Mira Luca Wolf-Bauwens
Ioana Giurgiu
Michael Hind
Peter Urbanetz","10.48550/arxiv.2412.01957","https://scispace.compdf/usage-governance-advisor-from-intent-to-ai-governance-2axhub0husw3.pdf","Evaluating the safety of AI Systems is a pressing concern for organizations deploying them. In addition to the societal damage done by the lack of fairness of those systems, deployers are concerned about the legal repercussions and the reputational damage incurred by the use of models that are unsafe. Safety covers both what a model does; e.g., can it be used to reveal personal information from its training set, and how a model was built; e.g., was it only trained on licensed data sets. Determining the safety of an AI system requires gathering information from a wide set of heterogeneous sources including safety benchmarks and technical documentation for the set of models used in that system. In addition, responsible use is encouraged through mechanisms that advise and help the user to take mitigating actions where safety risks are detected. We present Usage Governance Advisor which creates semi-structured governance information, identifies and prioritizes risks according to the intended use case, recommends appropriate benchmarks and risk assessments and importantly proposes mitigation strategies and actions. ","in their truth. This pipeline consists of: ingestion, entity/relationship extraction, and augmenting with evidence and confidence measures. AI Systems Knowledge Graph (KG): The entire pipeline is coordinated using the langchain (LangChain 2024) framework. AI Systems Knowledge Graph (KG):
 Ingestion: We first classify documents to determine their nature. This helps in identifying entities and relationships for extraction, i.e. if the document is about a specific AI Model e.g. LLAMA-3, then most relationships will link that entity to other entities, e.g. its license. AI Systems Knowledge Graph (KG):
 Simple term frequency highlights the document's main subject such as an AI model or regulation. This focuses the extraction process and narrows the relevant subset of the ontology to consider. Similar work is discussed in . AI Systems Knowledge Graph (KG):
 After classifying the document, we decompose the text of the document into chunks that can be treated in isolation by the generative pipeline. The process retains the relationship between chunks of the document. AI Systems Knowledge Graph (KG):
 The chunks are labeled with additional information such as the classification, section title, and their location in the document. Some overlap with the previous and next chunk is included. We adapt the method described in  for chunking PDFs in a manner suitable for Retrieval-Augmented Generation (RAG) ) systems. AI Systems Knowledge Graph (KG):
 Entity/Relationship Extraction: To organize the information from the documents into the KG, it needs to be converted to entities and relationships following the types described in the ontology. AI Systems Knowledge Graph (KG):
 Pragmatically, to reduce the complexity of the problem, we make the following assumptions: 1) the entity types relevant to the document have been extracted in the ingestion phase, so we do not need to consider Figure : Risk Taxonomy Mappings the entire ontology when processing a document 2) there is no need to extract the specific relationship types between two entities, only as to whether two entities are related; the relationship should be implicit from the ontology. AI Systems Knowledge Graph (KG):
 This reduces the expressiveness of the ontology but we believe that this isn't prohibitive for the domain being modelled. AI Systems Knowledge Graph (KG):
 A further simplification is that we do not try to identify entities with properties as defined in the ontology, but rather we promote properties to entities themselves. We found that it is simpler to perform only simple entity recognition rather than identifying entities and their associated properties together. AI Systems Knowledge Graph (KG):
 So for example, the energy usage of a AI model is a distinct entity, rather than a property of that model. AI Systems Knowledge Graph (KG):
 The reason for this is that when relevant information is available in different chunks spread across a large document it is simpler to relate distinct entities found in different chunks rather than updating properties of the same entity. Auto-assist questionnaire:
 To help manage the deployment of LLMs, organizations follow a process to identify and mitigate risks. A key component of this process is the completion of questionnaires to aid in assessing the risks associated with the specific AI use case and model being deployed."
"The Artificial Intelligence Ontology: LLM-Assisted Construction of AI Concept Hierarchies","https://scispace.com/paper/the-artificial-intelligence-ontology-llm-assisted-7a1cjgvl4fdk","2024","Journal Article","Applied Ontology","Marcin P. Joachimiak
Mark A. Miller
J. Harry Caufield
Ryan Ly
Nomi L. Harris
Andrew Tritt
Chris Mungall
Kristofer E. Bouchard","10.1177/15705838241304103","https://scispace.compdf/the-artificial-intelligence-ontology-llm-assisted-7a1cjgvl4fdk.pdf","The Artificial Intelligence Ontology (AIO) is a systematization of artificial intelligence (AI) concepts, methodologies, and their interrelations. Developed via manual curation, with the additional assistance of large language models (LLMs), AIO aims to address the rapidly evolving landscape of AI by providing a comprehensive framework that encompasses both technical and ethical aspects of AI technologies. The primary audience for AIO includes AI researchers, developers, and educators seeking standardized terminology and concepts within the AI domain. We use the term “branches” for classes, and their subclasses, in our ontology that are subclasses of owl:Thing. AIO contains eight branches: Bias, Layer, Machine Learning Task, Mathematical Function, Model, Network, Preprocessing, and Training Strategy, each designed to support the modular composition of AI methods and facilitate a deeper understanding of deep learning architectures and ethical considerations in AI. AIO uses the Ontology Development Kit (ODK) for its creation and maintenance, with its content being more easily updated through AI-driven curation support. This approach not only ensures the ontology's relevance amidst the fast-paced advancements in AI but also significantly enhances its utility for researchers, developers, and educators by simplifying the integration of new AI concepts and methodologies. The ontology's utility is demonstrated through the annotation of AI methods data in a catalog of AI research publications and the integration into the BioPortal ontology resource, highlighting its potential for cross-disciplinary research. The AIO ontology is open source and is available on GitHub ( https://w3id.org/aio/ ) and BioPortal ( https://bioportal.bioontology.org/ontologies/AIO ). ","approaches. Introduction: With an eye toward technical applications, we have aligned the ontology with terminology used in ML platforms such as Tensorflow and PyTorch. We have designed AIO to be rapidly extendable and responsive to new innovations in the field. Introduction:
 Crucially, we have also included classes related to the ethical and legal impact of AI methods  (for example, we define Bias as a top-level class). Introduction:
 Finally, AIO was designed for and built with LLM-assisted content suggestion and curation support, which allows the ontology to more easily keep up to date and scale with advances in the AI fields. Introduction:
 Collectively, these design decisions enable AIO to satisfy community needs regarding standardization of AI/ML concepts across its numerous areas of application. The AIO is an open source project (https://github.com/berkeleybop/artificial-intelligence-ontology) Introduction:
 that encourages the broader community not only to make use of the ontology and related tools, but also to contribute comments, requests, and additions. Methods:
 Ontology Creation using the Ontology Development Kit Methods:
 We used the Ontology Development Kit (ODK)  to organize the AIO and to set up a GitHub repository (https://github.com/berkeleybop/artificial-intelligence-ontology) containing source components and workflows to build the ontology. The ODK includes a suite of ontology tools, including the very configurable open source ROBOT library (R. C. . Methods:
 As a result, each AIO build includes artifacts in a variety of serializations (OBO, OWL, and obojson) and variations to support multiple use cases (e.g., a base version without imported axioms). AIO is built from an ontology ROBOT template (Sup. Info.). Methods:
 ODK also enables straightforward reproducibility as it is distributed as a Docker container; any user may build or modify AIO with the same set of open-source tools used in ""official"" builds. Methods:
 We make each release of this ontology available through BioPortal . The BioPortal platform provides straightforward navigation of the AIO hierarchy and accessibility through a central API as well as a web UI. Methods:
 Additionally, the Bioportal API enables automatic generation of predicted lexical mappings between AIO classes and those in other ontologies. The ontology is also available as a SQLite database via the semantic-sql repository, allowing for expressive SQL queries, or programmatic access via the OAK library. Curation and ingestion of individual branches:
 Data sources for individual ontology branches are as follows. The Network branch was developed from various sources including publications (Sarker, 2021), the Asimov Institute Neural Network Zoo . Names of layers and functions used in AI method development were sourced from pyTorch  and TensorFlow  documentation. Curation and ingestion of individual branches:
 We included all Layers and Functions from TensorFlow, but for demonstration purposes we included only Normalization and Pooling Layers from PyTorch. LLM and Preprocessing classes were developed using LLM approaches (see AI-driven curation support). AI Biases were sourced from a NIST report on AI bias  as well as from Wikipedia. Curation and ingestion of individual branches:
 General machine learning methods were sourced from Wikipedia and textbooks . References for each ontology class are provided in the AIO data serializations produced by the ODK build."
"OM4OV: Leveraging Ontology Matching for Ontology Versioning","https://scispace.com/paper/om4ov-leveraging-ontology-matching-for-ontology-versioning-7fqzh1i25ear","2024","Journal Article","","Zhangcheng Qiang
Kerry Taylor","10.48550/arxiv.2409.20302","https://scispace.compdf/om4ov-leveraging-ontology-matching-for-ontology-versioning-7fqzh1i25ear.pdf","Due to the dynamic nature of the semantic web, ontology version control is required to capture time-varying information, most importantly for widely-used ontologies. Despite the long-standing recognition of ontology versioning (OV) as a crucial component for efficient ontology management, the growing size of ontologies and accumulating errors caused by manual labour overwhelm current OV approaches. In this paper, we propose yet another approach to performing OV using existing ontology matching (OM) techniques and systems. We introduce a unified OM4OV pipeline. From an OM perspective, we reconstruct a new task formulation, performance measurement, and dataset construction for OV tasks. Reusing the prior alignment(s) from OM, we also propose a cross-reference mechanism to effectively reduce the matching candidature and improve overall OV performance. We experimentally validate the OM4OV pipeline and its cross-reference mechanism using three datasets from the Alignment Evaluation Initiative (OAEI) and exploit insights on OM used for OV tasks. ","for OV tasks, (2) significantly reduces the matching candidates, and (3) improves overall performance. We incorporate the OM4OV pipeline into a new OV system called Agent-OV, a functional extension of Agent-OM to handle OV tasks. VII. CONCLUSION:
 Evaluations of three OAEI datasets validate the feasibility and reliability of our system. We also argue that the false mappings detected by OV systems are not necessarily actual false mappings. VII. CONCLUSION:
 Our approach is compatible with ontologies using different versioning methods (using URIs or additional versioning triples), and even ontologies missing or without version information. Our approach stores the version information independently from the ontology, offering a simple and lightweight way to track versioning changes in ontologies. VII. CONCLUSION:
 In the future, we plan to apply the OM4OV pipeline in emerging domain ontologies that require consistent changes over time (e.g. smart building ontologies Brick Schema , RealEstateCore , and ASHRAE Standard 223P ). VII. CONCLUSION:
 Supplemental Material Statement: Agent-OV is an extended version of Agent-OM. Agent-OM can be downloaded from https://github.com/qzc438-research/ontology-llm. The OAEI track repositories used in this study can be downloaded from OAEI MELT at https://dwslab.github.io/melt/ track-repository (date accessed: 2024-06-01). The OAEI data policy can be found in https://oaei.ontologymatching.org/doc/ oaei-deontology.2.html. ACKNOWLEDGMENT:
 The authors would like to thank Alice Richardson of the Statistical Support Network, Australian National University (ANU), for helpful advice on the statistical analysis in this paper. The authors also thank the Commonwealth Scientific and Industrial Research Organisation (CSIRO) for supporting this project."
"Digital Twin Applications in Urban Logistics: An Overview","https://scispace.com/paper/digital-twin-applications-in-urban-logistics-an-overview-30ig6czc","2023","Journal Article","Urban, planning and transport research","Abdo Abouelrous
Laurens Bliek
Yingqian Zhang","10.48550/arXiv.2302.00484","https://scispace.compdf/digital-twin-applications-in-urban-logistics-an-overview-30ig6czc.pdf","Urban traffic attributed to commercial and industrial transportation is observed to largely affect living standards in cities due to external effects pertaining to pollution and congestion. In order to counter this, smart cities deploy technological tools to achieve sustainability. Such tools include Digital Twins (DT)s which are virtual replicas of real-life physical systems. Research suggests that DTs can be very beneficial in how they control a physical system by constantly optimizing its performance. The concept has been extensively studied in other technology-driven industries like manufacturing. However, little work has been done with regards to their application in urban logistics. In this paper, we seek to provide a framework by which DTs could be easily adapted to urban logistics networks. To do this, we provide a characterization of key factors in urban logistics for dynamic decision-making. We also survey previous research on DT applications in urban logistics as we found that a holistic overview is lacking. Using this knowledge in combination with the characterization, we produce a conceptual model that describes the ontology, learning capabilities and optimization prowess of an urban logistics digital twin through its quantitative models. We finish off with a discussion on potential research benefits and limitations based on previous research and our practical experience.","an integral component of DTs as it embeds the quantitative tools that express its analytical capabilities. In turn, human controllers should consistently strive to improve its content so as to equip the DT sufficiently to analyze very complex processes and bring added value through optimization. Knowledge Base:
 In order to arrive at a compact design of the ontology, we merge these four into a single high-level entity which we refer to as the AI component. This is because their relationships with other entities in the ontology and among each other are more or less identical. Knowledge Base:
 At the high-level, our ontology is given in Figure  where all entities are defined as well as their associated relations. The feedback-loop constituted by the bidirectional data exchange to optimize current operations and learn from past ones to improve future ones is given by the red arrows. Knowledge Base:
 In particular, data is collected from resources and used as input to the AI component. Knowledge Base:
 The AI component processes the data to support decision-making through optimization. Once decisions have been implemented, KPIs are generated which are collected again as data to evaluate the decisions and learn from them. At a secondary level, the ontology of the AI component itself is given in Figure . Knowledge Base:
 The four components interact regularly with each other to support their functionalities. Knowledge Base:
 The output of one component can be used as the input to another, in contrast to the ordered pattern introduced in Figure . Figure  could, thus, be viewed as a generalization of Figure . It can also be viewed as an arbitrary pipeline of models. Knowledge Base:
 The same logic holds the other way round as any pipeline of these models could be categorized under the ontology of Figure . To demonstrate this, we provide an example below for solving a Vehicle Routing Problem (VRP) variant. Knowledge Base:
 We explain how a pipeline could be constructed from an algorithmic set-up, how it integrates into the framework of the DT and how the DT uses its capabilities to improve the AI models through its real-time connectivity. Knowledge Base:
 However, we first provide a brief overview of previous research on how the aforementioned AI tools complement each other in decision-making for urban logistics -with a focus on routing operations -in the following section. Knowledge Base:
 Our focus on routing stems from our observation of the academic interest surrounding problems such as VRP and the importance of solving VRP variants for the daily operations of LSPs. AI Pipeline Construction:
 There are some parts of the AI component that we pay little attention to. For instance, we consider statistical analysis to be a more traditional method where the computing powers of AI are less relevant. AI Pipeline Construction:
 For simulation, we provide a brief discussion as it remains a relevant tool for digitaltwins for scenario-assessment especially. We are most interested in the combination of machinelearning and optimization as dictated by the concepts of data-driven optimization which we regard as the primary computing asset of AI. AI Pipeline Construction:
 Starting with simulation and optimization, a comprehensive overview of the different methods for different simulators is given in . use simulation optimization to decide on the number and location of parcel lockers to which consumer goods are delivered. use simulation optimization to solve a complex Location Routing Problem (LRP). AI Pipeline Construction:
 Applications in VRP are also abundant as shown in  for the case with stochastic demands, and Pérez-Rodríguez & Hernández-Aguirre ( ) with fixed time-windows."
"Ontology-Enhanced Decision-Making for Autonomous Agents in Dynamic and
  Partially Observable Environments","https://scispace.com/paper/ontology-enhanced-decision-making-for-autonomous-agents-in-3hil6r6ipr","2024","Preprint","","Saeedeh Ghanadbashi
Fatemeh Golpayegani","10.48550/arxiv.2405.17691","https://scispace.compdf/ontology-enhanced-decision-making-for-autonomous-agents-in-3hil6r6ipr.pdf","Agents, whether software or hardware, perceive their environment through sensors and act using actuators, often operating in dynamic, partially observable settings. They face challenges like incomplete and noisy data, unforeseen situations, and the need to adapt goals in real-time. Traditional reasoning and ML methods, including Reinforcement Learning (RL), help but are limited by data needs, predefined goals, and extensive exploration periods. Ontologies offer a solution by integrating diverse information sources, enhancing decision-making in complex environments. This thesis introduces an ontology-enhanced decision-making model (OntoDeM) for autonomous agents. OntoDeM enriches agents' domain knowledge, allowing them to interpret unforeseen events, generate or adapt goals, and make better decisions. Key contributions include: 1. An ontology-based method to improve agents' real-time observations using prior knowledge. 2. The OntoDeM model for handling dynamic, unforeseen situations by evolving or generating new goals. 3. Implementation and evaluation in four real-world applications, demonstrating its effectiveness. Compared to traditional and advanced learning algorithms, OntoDeM shows superior performance in improving agents' observations and decision-making in dynamic, partially observable environments. ","inform-ation layer enabling interconnectivity, interoperability, and coordination of activities between intelligent heterogeneous systems in an environment. Ontology-based Approaches: Some AI techniques enhance agents' learning process by providing semantic models and augmented feedback loops to optimize their overall accuracy . Ontology-based Approaches:
 As part of ML tasks, ontologies are used in several ways, including enrichment of features derived from the ontology, calculating similarities or distances between instances based on the ontology's structure, and determining probabilistic dependencies between instances and features based on the entities' dependencies in the ontology . Ontology-based Approaches:
 Domainspecific knowledge encoded with ontology can be used to constrain search and find optimal or near-optimal solutions faster or find a solution that is generalized better . proposed a summarization method that reinforces learning functions by using semantic relationships between ontology concepts. Ontology-based Approaches:
 The authors of  created an ontology base on classification results and queried this ontology instead of querying the decision tree. To improve the accuracy of a Support Vector Machine (SVM) algorithm,  used ontology augmentation as a feedback loop. Ontology-based Approaches:
 In , the authors modeled the TSC context using a fuzzy ontology for reusing knowledge and firing suitable fuzzy rules using a fuzzy inference engine. The approach proposed in , enriches the semantics of the raw sensor data and infers contextual description through context-aware attributes. Ontology-based Approaches:
 In SASs, ontology is mainly used as a modeling method to specify the requirements of a system-to-be. For example, in , the authors used a goal ontology containing semantic knowledge about the system's goals and the relationship between goals and sub-goals. Ontology-based Approaches:
 In , the authors used a shared ontology, which includes concepts about the domain and conditions relating to them to support a shared understanding of concepts between the user and the system. Ontology-based Approaches:
 The shared ontology enables the system to update the specification when a refinement or addition of new concepts occurs and also understand the service descriptions for solution provisioning. Ontology-based Approaches:
 To manage the heterogeneity of real-world systems, in , the authors used ontologies, leveraging their ability to provide a shared and unified representation of a complex and heterogeneous domain of interest. Ontology-based Approaches:
 In , the authors modeled the environment using an ontology that defines the concepts and available actions to the system for test generation. In , the authors proposed a framework to enable Continuous Adaptive Requirements Engineering (CARE) that leverages the requirements-aware systems and exploits a reasoning system. Ontology-based Approaches:
 A fuzzy theory and semantic distance technology  were proposed to handle inaccurate monitoring data. Self-adaptive activity recognition systems  aim to recognize complex Activities of Daily Living (ADL) from a series of observations of the individual's actions and the environmental conditions. Ontology-based Approaches:
 In , the authors proposed a new approach that relies on an ontology to derive a first set of semantic correlation values between activities and sensor events. In , the authors introduced an incremental learning method to integrate new data with new features into current activity recognition models. Ontology-based Approaches:
 In , the authors proposed a new domain adaptation technique that uses a general ontology to share and transfer activity models across individuals, even though the sensor deployments and operating environments are different."
