"Paper Title","Paper Link","Publication Year","Publication Type","Publication Title","Author Names","DOI","PDF Link","Abstract","Relevant Excerpt"
"An Enhanced ELECTRE II Method for Multi-Attribute Ontology Ranking with Z-Numbers and Probabilistic Linguistic Term Set","https://scispace.com/paper/an-enhanced-electre-ii-method-for-multi-attribute-ontology-1ze9osom","2022","Journal Article","Future Internet","Ameeth Sooklall
Jean Vincent Fonou Dombeu","10.3390/fi14100271","https://scispace.com/pdf/an-enhanced-electre-ii-method-for-multi-attribute-ontology-1ze9osom.pdf","The high number of ontologies available on the web to date makes it increasingly difficult to select appropriate ontologies for reuse. Many studies have attempted to provide support for ontology selection and ranking; however, the existing studies provide support for ontology ranking from an objective perspective as opposed to a subjective perspective. They do not take into account the qualitative aspects of ontologies. Furthermore, the existing methods have a limited focus on group environments. In this paper, a multi-criteria decision-making approach is presented for ontology ranking with the development of an enhanced model combining the ELECTRE II model with the Z-Probabilistic Linguistic Term Set (ZPLTS). The ZPLTS-ELECTRE II model enables decision-makers to model ontology ranking problems using both numerical and linguistic data. Furthermore, the newly proposed model provides support for ontology ranking in group settings, with an emphasis on modeling the differing levels of credibility of decision-makers using the ZPLTS, which allows decision-makers to not only specify their opinion but also specify their level of credibility. The model was applied to rank a set of mental health ontologies obtained from the BioPortal repository. The results showed that the method was able to rank the ontologies successfully. The results were further compared with the traditional ELECTRE II and the PLTS ELECTRE II methods, displaying superior modeling capabilities. This paper demonstrated the effectiveness of the newly proposed ZPLTS-ELECTRE II model for ontology ranking in a real-world context, but the method is not constrained to the ontology ranking domain; rather, it may be applied to other real-world decision problems as well.","Term Set Authors: Ameeth Sooklall,Jean Vincent Fonou-Dombeu Keywords: ZPLTS-ELECTRE II, ELECTRE, ontology ranking, Z-number, probabilistic linguistic term set, multi-criteria decision-making Introduction:
 The concept of ontology is becoming increasingly valuable in the field of artificial intelligence (AI) and big data . An ontology is defined as an explicit specification of a shared conceptualization , and it is one of the core components facilitating knowledge representation and reasoning in AI. Ontologies describe different domains of discourse, and they play an important role in representing and expressing complex knowledge in a form that facilitates reasoning, computation, and dissemination. Ontologies provide an efficient solution to manage and advance the pressing issues of knowledge and information overload. Ontologies also provide an efficient and effective model for the comprehension of the myriad semantics associated with various knowledge and information, among different systems, agents, and technologies. Introduction:
 The field of ontology and ontological engineering has been studied extensively in recent years, and as such, scientists and subject matter experts have developed a wide range of ontologies belonging to various domains. Ontologies are also witnessing a surge in real-world applications; some of their applications are found in areas such as agriculture , finance , education , and engineering . There are currently a wide range of ontologies freely available online for download, hosted in repositories such as the BioPortal [7] and the AgroPortal  ontology repositories. However, ontologies are inherently complex structures, which makes them highly arduous to architect and develop. A wide range of expertise is required for the research and development of an ontology. Accordingly, this process can be very costly and time consuming. Whilst some projects may require a new ontology to be developed de novo, for most projects, there is already a variety of existing ontologies available to choose from. Therefore, it is more efficient to reuse existing ontologies, possibly with some modifications, as opposed to developing new ontologies de novo. Unfortunately, the large number of ontologies available online also has a downside, giving rise to a new problem altogether-the problem of ontology selection. Introduction:
 The ontology selection problem arises due to the complexity associated with ontologies, which makes it challenging for users to comprehend and analyze existing ontologies. This problem is worsened when given the choice of multiple ontologies to choose from. It is therefore evident that there is an urgent need for the development of techniques and methods for evaluating and selecting relevant ontologies for the purpose of reuse. Introduction:
 There have been attempts by authors  to rank ontologies to aid their selection, but only in recent years has there been attempts to rank ontologies from a decision-making perspective . The issue of ontology selection is essentially a multi-criteria decisionmaking (MCDM) problem, as there are multiple ontologies to choose from, whilst considering multiple characteristics and attributes. Authors have applied MCDM techniques for the task of ontology ranking and selection, such as ELECTRE, Technique for Order Preference by Similarity to Ideal Solution (TOPSIS) , Weighted Linear Combination Ranking Technique (WLCRT) , and so on. However, these previous research studies present some shortcomings, which are elaborated on as follows."
"Governing AI Agents","https://scispace.com/paper/governing-ai-agents-3pdf0lr5pzuj","2025","Journal Article","","Noam Kolt","10.48550/arxiv.2501.07913","https://scispace.compdf/governing-ai-agents-3pdf0lr5pzuj.pdf","The field of AI is undergoing a fundamental transition from systems that can produce synthetic content upon request to autonomous agents that can plan and execute complex tasks with only limited human involvement. Companies that pioneered the development of generative AI tools are now building AI agents that can be instructed to independently navigate the internet, perform a wide range of online tasks, and serve as artificial personal assistants and virtual coworkers. The opportunities presented by this new technology are tremendous, as are the associated risks. Fortunately, there exist robust analytic frameworks for confronting many of these challenges, namely, the economic theory of principal-agent problems and the common law doctrine of agency relationships. Drawing on these frameworks, this Article makes three contributions. First, it uses agency law and theory to identify and characterize problems arising from AI agents, including issues of information asymmetry, discretionary authority, and loyalty. Second, it illustrates the limitations of conventional solutions to agency problems: incentive design, monitoring, and enforcement might not be effective for governing AI agents that make uninterpretable decisions and operate at unprecedented speed and scale. Third, the Article explores the implications of agency law and theory for designing and regulating AI agents, arguing that new technical and legal infrastructure is needed to support governance principles of inclusivity, visibility, and liability. ","certain actions. hat being said, AutoGPT's developers intended to incrementally relax this (2024). See Seth Lazar, The Rise and Fall (and Rise Again) of the First AI Agent Millionaire, TECH POLICY PRESS (Oct. B. Goal, Plan, Action:
 45 See Significant-Gravitas, AutoGPT, GITHUB (Mar. 30, 2023), https://github.com/ Significant-Gravitas/AutoGPT; Kyle Wiggers, What is Auto- GPT and Why Does It Matter?,  TECHCRUNCH (Apr. 22, 2023), https://techcrunch.com/2023/04/22/what-is-auto-gpt-andwhy-does-it-matter/. For related work, see Yohei Nakajima, BabyAGI, GITHUB (Apr. 2023), https://github.com/yoheinakajima/babyagi; Erik Bjare, GPT-Engineer, GITHUB (June 2023). See Dan Murray-Serter (@danmurrayserter), X (TWITTER) (Apr. B. Goal, Plan, Action:
 24, 2023, 5:00PM), https://twitter.com/danmurrayserter/status/1650499941775679488. See AutoGPT Agent Documentation, https://docs.agpt.co/autogpt/. B. Goal, Plan, Action:
 requirement and grant the agent greater autonomy. o the extent AI agents become more reliable and are used more widely, new social and economic dynamics are likely to emerge. For example, interpersonal encounters might be increasingly mediated or even altogether obviated by AI agents. B. Goal, Plan, Action:
 An uncomfortable conversation with a colleague or a complaint to the local council could be outsourced to a person's AI agents. Similarly, parties to a business transaction could delegate certain responsibilities to their respective AI agents. 50 B. Goal, Plan, Action:
 While these developments could offer consumers and businesses substantial productivity gains, they also raise noteworthy concerns. C. Concerns:
 The range of risks posed by AI technology, including language models, is wide and growing. It includes risks of ""hallucinations,"" toxic outputs, bias, discrimination, environmental harms, and leakage of sensitive personal data, to name just a few. C. Concerns:
 Because AI agents rely extensively on language models, AI agents are susceptible to all of these familiar risks. AI agents, however, also pose new, and potentially more concerning, risks. C. Concerns:
 For example, while a chatbot can provide instructions on how to conduct an online phishing campaign, an AI agent can actually execute those instructions. C. Concerns:
 The stakes, in other words, are higher because AI agents not only communicate with humans but take actions that can directly affect individuals' rights and interests. 52 Id. (""as the project progresses we'll be able to give the agent more autonomy and only require consent for select actions.""). C. Concerns:
 See Lazar, supra note 38 (""[language models] might enable us to design universal intermediaries, generative agents sitting between us and our digital technologies, enabling us to simply voice an intention and see it effectively actualised by those systems."
"Cloud Infrastructure Management in the Age of AI Agents","https://scispace.com/paper/cloud-infrastructure-management-in-the-age-of-ai-agents-ojhdkgmdna8q","2025","Journal Article","arXiv.org","Zhenning Yang
Archit Bhatnagar
Yiming Qiu
Tongyuan Miao
Patrick Tser Jern Kon
Yunming Xiao
Yibo Huang
Martin Casado
Ang Chen","10.48550/arxiv.2506.12270","https://scispace.compdf/cloud-infrastructure-management-in-the-age-of-ai-agents-ojhdkgmdna8q.pdf","Cloud infrastructure is the cornerstone of the modern IT industry. However, managing this infrastructure effectively requires considerable manual effort from the DevOps engineering team. We make a case for developing AI agents powered by large language models (LLMs) to automate cloud infrastructure management tasks. In a preliminary study, we investigate the potential for AI agents to use different cloud/user interfaces such as software development kits (SDK), command line interfaces (CLI), Infrastructure-as-Code (IaC) platforms, and web portals. We report takeaways on their effectiveness on different management tasks, and identify research challenges and potential solutions.","Zhenning Yang,Archit Bhatnagar,Yiming Qiu,Tongyuan Miao,Patrick Tser,Jern Kon,Yunming Xiao,Yibo Huang,Martin Casado,Ang Chen,U C Berkeley,Andreessen Horowitz INTRODUCTION:
 Cloud computing has transformed the technology sectortoday, 94% enterprises use the cloud . However, managing the cloud infrastructure remains a challenging task. INTRODUCTION:
 Cloud tenants (e.g., EA Games, Home Depot) need to customize their infrastructure for diverse workloads, but cloud providers (e.g., Amazon/Microsoft/Google) only expose a shim management layer to third-party users without revealing system internals. INTRODUCTION:
 Management is also a continuous endeavor across the entire infrastructure lifecycle-provisioning resources, runtime monitoring, and resource updates-each with its own requirements and challenges. INTRODUCTION:
 To handle these tasks, tenants employ teams of DevOps (i.e., Development/Operation) engineers to supervise their cloud infrastructure. INTRODUCTION:
 Four cloud management modalities have gained popularity, tuned for DevOps engineers with different experience and perferences: (i) cloud software development kits (SDK) libraries, used for imperative programming; (ii) command line interface (CLI) embedded into user terminals; (iii) infrastructure-as-code (IaC)  configurations that encode cloud resources in a declarative manner; as well as (iv) web portal clicks (ClickOps), the ""no-code/low-code"" option. INTRODUCTION:
 Although these options are all built atop low-level RESTful cloud APIs, they present higher-level interfaces and are easier to use than RESTful API invocations. INTRODUCTION:
 Nevertheless, the complexity of the cloud ensures that all of these options still come with a substantial learning curve. Lifecycle management remains tedious and error-prone, often requiring manual trial-and-error steps. INTRODUCTION:
 DevOps engineers often find themselves performing repetitive tasks such *Equal contribution as reading cloud documentation, understanding user requirements, debugging failures, and checking policy compliance (e.g., GDPR). Management challenges further intensify as more and more organizations embrace multi-cloud deployments  to avoid vendor lock-in. INTRODUCTION:
 This additionally requires DevOps engineers to master significantly different cloud environments, which creates further burden. INTRODUCTION:
 We present a vision where human engineers are assisted by AI for cloud management. Recent advances in AI agents built on top of large language models (LLMs) have shown great promise in carrying out complex tasks. INTRODUCTION:
 AI agents enhance LLMs with additional capabilities-e.g., reasoning loops , external tool usage , and memory management -to interpret user instructions, make complex decisions, generate execution plans, and invoke external services to interact with the environment. INTRODUCTION:
 As AI agents become increasingly powerful, we believe that now is the right time to rethink DevOps engineering in light of this trend. INTRODUCTION:
 We are motivated by several questions along this direction: Can AI agents potentially serve as cloud DevOps engineers, reducing human burden and improving productivity? What types of tooling might be the best fit for cloud AI agents? INTRODUCTION:
 What are the research challenges that we must overcome in developing these agents, and what are some potential solutions? INTRODUCTION:
 We believe that cloud management has a few characteristics that are a suitable match for an agentic design. First, compared to traditional software engineering tasks, cloud management tasks are highly structured and repetitive, which helps constrain the problem search space of agents."
"Towards a Roadmap on Software Engineering for Responsible AI","https://scispace.com/paper/towards-a-roadmap-on-software-engineering-for-responsible-ai-2iq3z4tb","2022","Posted Content","","","10.48550/arxiv.2203.08594","https://scispace.com/pdf/towards-a-roadmap-on-software-engineering-for-responsible-ai-2iq3z4tb.pdf","Although AI is transforming the world, there are serious concerns about its ability to behave and make decisions responsibly. Many ethical regulations, principles, and frameworks for responsible AI have been issued recently. However, they are high level and difficult to put into practice. On the other hand, most AI researchers focus on algorithmic solutions, while the responsible AI challenges actually crosscut the entire engineering lifecycle and components of AI systems. To close the gap in operationalizing responsible AI, this paper aims to develop a roadmap on software engineering for responsible AI. The roadmap focuses on (i) establishing multi-level governance for responsible AI systems, (ii) setting up the development processes incorporating process-oriented practices for responsible AI systems, and (iii) building responsible-AI-by-design into AI systems through system-level architectural style, patterns and techniques. ","the AI systems, there is a strong desire for deployment strategies and continuous validation of responsible AI requirements. The deployment strategies include phased deployment (i.e., deploying AI systems for a subset group of users initially to reduce ethical risk), homogeneous redundancy, etc. Operations:
 The existing work on the continuous monitoring and validation mainly focuses on the AI system outputs (e.g., performance metrics -accuracy, precision, and recall ) rather than the outcomes (i.e. whether the AI system behaves and make decisions responsibly) . With different context data (e.g., users, traffic, weather) in operation, AI systems are continuously evolving to address ethical risks. The current practice for ethical risk assessment is often one-off type of risk assessment (e.g. Five Safes Framework ). Ethical risk assessment is expected to be dynamic, adaptive, and extensible for different context e.g., culture. . Version-based feedback (e.g., ethical violation) should be reported to the development team and other stakeholders continuously. Incentives can be applied to encourage the ethical outcomes of AI systems in terms of both decisions and behaviors. The time and frequency of validation and conditions of necessary retraining should be predefined . Operations:
 An AI system usually involves co-evolution of data, model, code, and configurations. Data/model/code/configuration co-versioning traces exactly what datasets and configuration parameters were used to train and evaluate the model. Co-evolution may also happen to AI components and non-AI components, thus co-versioning is required to facilitate the maintenance and communication between the AI component development team and non-AI component team. Operations:
 Bill of materials (BOM)  enables the transparency and accountability by keeping a formal record of the supply chain details of the components used in building an AI system, such as component name, version, supplier, dependency relationship, author and timestamp. Ethical audit trail records every step of AI systems from the ethics perspective. Developers need to consider trade-offs between accountability and performance when making design decisions on what date is placed on blockchain/cloud. Accountability knowledge graphs support capturing accountability information throughout the lifecycle of AI systems and auditing them programmatically. To build such knowledge graphs, ontology can be used to describe and model accountability information . Research Challenges:
 Integrating the software development process with the AI model development pipeline for ethical principles. Research Challenges:
 There is a methodological gap between the AI model development pipeline that produces the AI model and software development process that develops the non-AI components and AI components embedding AI model . Given the AI model pipeline is more experimental with still limited methodological support, integrating the AI model pipeline into the agile software development process needs better understanding of artifacts, activities and roles involved. Although initial tooling attempts have been made on the integration (such as Microsoft Team Data Science Process  and IBM Watson Studio  ), the integrated AI system development process still need to be standardized and supported by software tools taking into account responsible AI principles. Research Challenges:
 Capturing ethical principles by requirement engineering. Compared with traditional software and general responsible software, AI systems also need to consider requirements about models, training data, system autonomy oversight and may emphasize certain ethical requirements more due to AI-based autonomous and potentially opaque behaviour and decision making. In particular, some of the ethical principles are hard to define and quantify. To make the ethical principles be captured by requirements engineering for AI systems, the community should put further efforts on requirements engineering methods and provide a concrete guidance on requirement engineering for responsible AI systems."
"Advancing Frontiers in SLAM: A Survey of Symbolic Representation and
  Human-Machine Teaming in Environmental Mapping","https://scispace.com/paper/advancing-frontiers-in-slam-a-survey-of-symbolic-lxqofaydk9","2024","Preprint","","Brandon Curtis Colelough","10.48550/arxiv.2405.01398","https://scispace.compdf/advancing-frontiers-in-slam-a-survey-of-symbolic-lxqofaydk9.pdf","This survey paper presents a comprehensive overview of the latest advancements in the field of Simultaneous Localization and Mapping (SLAM) with a focus on the integration of symbolic representation of environment features. The paper synthesizes research trends in multi-agent systems (MAS) and human-machine teaming, highlighting their applications in both symbolic and sub-symbolic SLAM tasks. The survey emphasizes the evolution and significance of ontological designs and symbolic reasoning in creating sophisticated 2D and 3D maps of various environments. Central to this review is the exploration of different architectural approaches in SLAM, with a particular interest in the functionalities and applications of edge and control agent architectures in MAS settings. This study acknowledges the growing demand for enhanced human-machine collaboration in mapping tasks and examines how these collaborative efforts improve the accuracy and efficiency of environmental mapping ","having a clearly explainable or transparent process for obtaining said outputs. f : X − → Y: As such, some form of symbolic reasoning is required to generate a level of trust in the production of useful ground maps capable of summarising complex situations. f : X − → Y:
 This would enable their authenticity and as such enhance the situational awareness of an operator that is not already immersed in the low-level tactical situation . As described in , an ontology is a set of entities, which can be classes, properties, or individuals. f : X − → Y:
 ontologies may be used to standardise the knowledge base of a specific domain and allow readability by both human and machines, as has been demonstrated in . Ontologies are designed to represent complex knowledge sets about things and the relations between them. f : X − → Y:
 As described in chapter 1 subsections 2-3 of , the common components of an ontology are its individuals (or instances, I), classes (or concepts, C), attributes (a) and the relationships (R) linking them. Restrictions and rules can be placed upon these components to assert some knowledge about them. f : X − → Y:
 Axioms (A) are developed within the ontology to generate assertions to describe the overall theory of the ontology for its application domain. These assertions are provided in a logical form, such as for example: f : X − → Y:
 And hence, an ontology can be described (as it commonly is in literature) as a five-tuple : f : X − → Y:
 Transparency refers to an operator's awareness of an autonomous agent's actions, decisions, behaviours and intention . This system transparency is the overarching concept required to enable a trust architecture within the human-machine teamed environment. This transparency can be achieved through multiple methods such as interpretability, explainability and predictability . f : X − → Y:
 Utilising these ontologies provides a method to share semantic knowledge, promoting bi-directional transparency between humans and artificial agents  through the three key facets listed above. f : X − → Y:
 Therefore, the sub-set of symbolic AI that is ontological design offers enables explainability, interpretability and predictability within a system which is required to achieve transparency in an artificially intelligent system and hence enable the teamed operator to trust a swarm of robots to complete a cooperative function . f : X − → Y:
 ontologies have been applied extensively in many fields to incorporate expert level domain knowledge into symbolic solutions. f : X − → Y:
 A corpus for ontology and semantics was proposed in  that leverages the textual data documentations for semantic labelling and modelling from 101 separate data sets, which presents a great opportunity for researchers to create more thorough ontological-domain representative models. f : X − → Y:
 Utilising these hierarchical ontologies for guided learning in sub-symbolic systems is a concept that is explored by Campbell  (Chapter 6). This application enables a sub-symbolic system to reason on abstract concepts and reduce the dimensionality of a problem space (through partitioning) by applying prior knowledge to a learning system. f : X − → Y:
 Such a system is described by Hepworth in  (Chapter 7). Here, a hybrid approach to activity recognition is detailed that fuses both data-and ontology-driven approaches to the activity recognition problem space in the machine learning domain."
